<?xml version="1.0" encoding="UTF-8"?>
<!-- 
    Created by Cristiano Novelli 
    ENEA, Bologna, 2012-25-05   
    Version=0.1
    
    Notes:
    - The tebes namespace is defined to extend TAML with new elements or attributes used in the TeBES platform
-->

<taml:testAssertionSet 
    xmlns:taml="http://docs.oasis-open.org/ns/tag/taml-201002/"
    xmlns:xsi="http://www.w3.org/2001/XMLSchema-instance"
    xsi:schemaLocation="http://docs.oasis-open.org/ns/tag/taml-201002/ http://docs.oasis-open.org/tag/taml/v1.0/cs02/xsd/testAssertionMarkupLanguage.xsd"
    xmlns:tebes="http://www.ubl-italia.org/TeBES"
    setid="TC-001_TS-004"
    setname="Test Case for UBL Invoice Italian PEPPOL Schematron validation"
	tebes:version="0.1">
    
    <taml:testAssertionRefList listname="prerequisites"> 
        <!-- 
            The taml:testAssertionRef attributes have to take the following values:
            - @taid: testAssertion/@id of the test assertion;
            - @name: testAssertion/@name of the test assertion;
            - @tebes:version: version of this Test Suite specification for TeBES
        -->        
        <taml:testAssertionRef 
            taid="TA-001_TC-001_TS-003" 
            name="EUGEN-UBL-T10" 
            sourcedoc="http://www.ubl-italia.org/TeBES/testsuites/UBL/TS-003_eugen/TC-001_EUGEN-UBL-T10.xml" 
            tebes:version="0.1" />
    </taml:testAssertionRefList>	        	
    
    <taml:testAssertion 
        id="TA-001_TC-001_TS-004" 
        name="ITNAT-UBL-T10" 
        tebes:isNotePresent="false">

        <taml:description>
            Italian PEPPOL UBL Invoice Schematron Validation.
        </taml:description>
        
        <taml:normativeSource>
            <taml:comment></taml:comment>
            <taml:refSourceItem></taml:refSourceItem>
            <taml:textSourceItem></taml:textSourceItem>
        </taml:normativeSource>

        <taml:var vname="TA-001_TC-001_TS-003" vtype="http://docs.oasis-open.org/ns/tag/taml-201002/">taml:TA-001_TC-001_TS-003 eq 'pass'</taml:var>
        
        <taml:var vname="ITNAT-UBL-T10" vtype="http://purl.oclc.org/dsdl/schematron">http://www.ubl-italia.org/TeBES/schematrons/UBL-T10/itnat/schematron/UBL/ITNAT-UBL-T10.sch</taml:var>

        <taml:target type="xml">document</taml:target>
 
        <taml:prerequisite>TA-001_TC-001_TS-003</taml:prerequisite>        
        
        <taml:predicate>ITNAT-UBL-T10</taml:predicate>
        
        <taml:prescription level="mandatory" />
        
        <taml:report 
            label="pass" 
            message="OK Italian PEPPOL (ITNAT-UBL-T10) Schematron validation of UBL Invoice">
            The file is valid against Italian PEPPOL UBL2 Invoice Schematron.
        </taml:report>
        <taml:report 
            label="fail" 
            message="Failed Italian PEPPOL (ITNAT-UBL-T10) Schematron UBL Invoice validation">
            The file does not contain an UBL Invoice valid against BIICORE Schematron.
        </taml:report>
        <taml:report 
            label="notQualified" 
            message="Not qualified to perform the Italian PEPPOL (ITNAT-UBL-T10) Schematron UBL Invoice validation">
            The file is not valid against UBL Invoice XML Schema.
        </taml:report>
    </taml:testAssertion>           
    
</taml:testAssertionSet>
