<?xml version="1.0" encoding="UTF-8"?>
<!-- 
    Created by Cristiano Novelli 
    ENEA, Bologna, 2012-25-05   
    Version=0.1
    
    Notes:
    - The tebes namespace is defined to extend TAML with new elements or attributes used in the TeBES platform
-->

<taml:testAssertionSet 
    xmlns:taml="http://docs.oasis-open.org/ns/tag/taml-201002/"
    xmlns:xsi="http://www.w3.org/2001/XMLSchema-instance"
    xsi:schemaLocation="http://docs.oasis-open.org/ns/tag/taml-201002/ http://docs.oasis-open.org/tag/taml/v1.0/cs02/xsd/testAssertionMarkupLanguage.xsd"
    xmlns:tebes="http://www.ubl-italia.org/TeBES"
    setid="TC-001_TS-003"
    setname="Test Case for UBL Invoice European PEPPOL Schematron validation"
	tebes:version="0.1">
    
    <taml:testAssertionRefList listname="prerequisites">  
        <!-- 
            The taml:testAssertionRef attributes have to take the following values:
            - @taid: testAssertion/@id of the test assertion;
            - @name: testAssertion/@name of the test assertion;
            - @tebes:version: version of this Test Suite specification for TeBES
        -->
        <taml:testAssertionRef 
            taid="TA-001_TC-001_TS-002" 
            name="BIICORE-UBL-T10" 
            sourcedoc="http://www.ubl-italia.org/TeBES/testsuites/UBL/TS-002_bii/TC-001_BII-UBL-T10.xml" 
            tebes:version="0.1" />
        <taml:testAssertionRef 
            taid="TA-002_TC-001_TS-002" 
            name="BIIPROFILES-UBL-T10" 
            sourcedoc="http://www.ubl-italia.org/TeBES/testsuites/UBL/TS-002_bii/TC-001_BII-UBL-T10.xml" 
            tebes:version="0.1" />        
        <taml:testAssertionRef 
            taid="TA-003_TC-001_TS-002" 
            name="BIIRULES-UBL-T10" 
            sourcedoc="http://www.ubl-italia.org/TeBES/testsuites/UBL/TS-002_bii/TC-001_BII-UBL-T10.xml" 
            tebes:version="0.1" />    
    </taml:testAssertionRefList>	        	
    
    <taml:testAssertion 
        id="TA-001_TC-001_TS-003" 
        name="EUGEN-UBL-T10" 
        tebes:isNotePresent="false">

        <taml:description>
            European PEPPOL UBL Invoice Schematron Validation.
        </taml:description>
        
        <taml:normativeSource>
            <taml:comment></taml:comment>
            <taml:refSourceItem></taml:refSourceItem>
            <taml:textSourceItem></taml:textSourceItem>
        </taml:normativeSource>
        
        <taml:var vname="EUGEN-UBL-T10" vtype="http://purl.oclc.org/dsdl/schematron">http://winter.bologna.enea.it/peppol_schema_rep/schematron/eugen/UBL/EUGEN-UBL-T10.sch</taml:var>

        <taml:var vname="TA-001_TC-001_TS-002" vtype="http://docs.oasis-open.org/ns/tag/taml-201002/">taml:TA-001_TC-001_TS-002 eq 'pass'</taml:var>
        <taml:var vname="TA-002_TC-001_TS-002" vtype="http://docs.oasis-open.org/ns/tag/taml-201002/">taml:TA-002_TC-001_TS-002 eq 'pass'</taml:var>
        <taml:var vname="TA-003_TC-001_TS-002" vtype="http://docs.oasis-open.org/ns/tag/taml-201002/">taml:TA-003_TC-001_TS-002 eq 'pass'</taml:var>
        
        <taml:target lg="xml" type="document">document</taml:target>
        
        <!-- taml:prerequisite>TA-001_TC-001_TS-002 AND TA-002_TC-001_TS-002 AND TA-003_TC-001_TS-002</taml:prerequisite -->
        <taml:prerequisite>TA-003_TC-001_TS-002</taml:prerequisite>
        
        <taml:predicate>EUGEN-UBL-T10</taml:predicate>
        
        <taml:prescription level="mandatory" />
        
        <taml:report 
            label="pass" 
            message="OK European PEPPOL (EUGEN-UBL-T10) Schematron validation of UBL Invoice">
            The file is valid against European PEPPOL UBL2 Invoice Schematron.
        </taml:report>
        <taml:report 
            label="fail" 
            message="Failed European PEPPOL (EUGEN-UBL-T10) Schematron UBL Invoice validation">
            The file does not contain an UBL Invoice valid against BIICORE Schematron.
        </taml:report>
        <taml:report 
            label="notQualified" 
            message="Not qualified to perform the European PEPPOL (EUGEN-UBL-T10) Schematron UBL Invoice validation">
            The file is not valid against UBL Invoice XML Schema.
        </taml:report>
    </taml:testAssertion>

</taml:testAssertionSet>
