<?xml version="1.0" encoding="UTF-8"?>
<?xml-stylesheet type="text/xsl" href="../../../xsl/TeBES_TestSuite.xsl" ?>
<!-- 
    Created by Cristiano Novelli 
    ENEA, Bologna, 2012-25-05   
    Version=0.1
    
    Notes:
    - The tebes namespace is defined to extend TAML with new elements or attributes used in the TeBES platform
-->

<taml:testAssertionSet 
    xmlns:taml="http://docs.oasis-open.org/ns/tag/taml-201002/"
    xmlns:xsi="http://www.w3.org/2001/XMLSchema-instance"
    xsi:schemaLocation="http://docs.oasis-open.org/ns/tag/taml-201002/ http://docs.oasis-open.org/tag/taml/v1.0/cs02/xsd/testAssertionMarkupLanguage.xsd"
    xmlns:tebes="http://www.ubl-italia.org/TeBES"
    setid="TC-001_TS-005"
    setname="Test Case for UBL Invoice Italian INTERCENT-ER Schematron validation"
	tebes:version="0.1">
    
    <taml:testAssertionRefList listname="prerequisites"> 
        
        <!-- 
            The taml:testAssertionRef attributes have to take the following values:
            - @taid: testAssertion/@id of the test assertion;
            - @name: testAssertion/@name of the test assertion;
            - @tebes:version: version of this Test Suite specification for TeBES
        -->        
        <taml:testAssertionRef 
            taid="TA-001_TC-001_TS-004" 
            name="ITNAT-UBL-T10" 
            sourcedoc="http://winter.bologna.enea.it/tebes-artifacts/testsuites/UBL/TS-004_itnat/TC-001_ITNAT-UBL-T10.xml" 
            tebes:version="0.1" />
    </taml:testAssertionRefList>	        	
    
    <taml:testAssertion 
        id="TA-001_TC-001_TS-005" 
        name="SDI-UBL" 
        tebes:isNotePresent="false">

        <taml:description>Italian INTERCENT-ER UBL Invoice Schematron Validation.</taml:description>
        
        <taml:normativeSource>
            <taml:comment></taml:comment>
            <taml:refSourceItem></taml:refSourceItem>
            <taml:textSourceItem></taml:textSourceItem>
        </taml:normativeSource>

        <taml:var vname="TA-001_TC-001_TS-004" vtype="http://docs.oasis-open.org/ns/tag/taml-201002/">taml:TA-001_TC-001_TS-004 eq 'pass'</taml:var>

        <taml:var vname="SDI-UBL" vtype="http://purl.oclc.org/dsdl/schematron">http://winter.bologna.enea.it/peppol_schema_rep/schematron/sdi/SDI-UBL-T10.sch</taml:var>

        <taml:target type="document" lg="xml">document</taml:target>
  
        <taml:prerequisite>TA-001_TC-001_TS-004</taml:prerequisite>

        <taml:predicate>SDI-UBL</taml:predicate>
        
        <taml:prescription level="mandatory" />
        
        <taml:report 
            label="pass" 
            message="OK Italian Intercent-ER (SDI-UBL) Schematron validation of UBL Invoice">The file is valid against Italian Intercent-ER (SDI-UBL) UBL2 Invoice Schematron.</taml:report>
        <taml:report 
            label="fail" 
            message="Failed Italian Intercent-ER (SDI-UBL) Schematron UBL Invoice validation">Failed Italian Intercent-ER (SDI-UBL) Schematron UBL Invoice validation.</taml:report>
        <taml:report 
            label="notQualified" 
            message="Not qualified to perform the Italian Intercent-ER (SDI-UBL) Schematron UBL Invoice validation">The file is not qualified to perform the Italian Intercent-ER (SDI-UBL) Schematron UBL Invoice validation.</taml:report>
    </taml:testAssertion>	             
    
</taml:testAssertionSet>
