<?xml version="1.0" encoding="UTF-8"?>

<!-- 
	Created by Cristiano Novelli 
	ENEA, Bologna, 2012-25-05   
	Version=0.1
	
	Notes:
	- The ublin namespace identifies the UBL 2.0 XML Schema
	- The tebes namespace is defined to extend TAML with new elements or attributes used in the TeBES platform
-->

<taml:testAssertionSet 
    xmlns:taml="http://docs.oasis-open.org/ns/tag/taml-201002/"
    xmlns:xsi="http://www.w3.org/2001/XMLSchema-instance"
    xsi:schemaLocation="http://docs.oasis-open.org/ns/tag/taml-201002/ http://docs.oasis-open.org/tag/taml/v1.0/cs02/xsd/testAssertionMarkupLanguage.xsd"
	xmlns:tebes="http://www.ubl-italia.org/TeBES"
    setid="TC-001_TS-001"
    setname="Test Case for UBL Invoice XML Schema validation"
	tebes:version="0.1">

    <!-- 
        L'elemento common viene utilizzato per definire elementi che potranno venire riutilizzati nelle test assertions seguenti 
       ma anche per definire nuovi namespace, come in questo caso in cui ho necessitÃ  di definire un XML Schema per la validazione
    -->
    <taml:common>
        <taml:namespaces 
            xmlns:ublin="http://winter.bologna.enea.it/peppol_schema_rep/xsd/maindoc/UBL-Invoice-2.0.xsd" />
    </taml:common>
    
    <taml:testAssertion 
        id="TA-001_TC-001_TS-001" 
        name="UBL Invoice XML Schema Validation" 
        tebes:isNotePresent="true">

        <taml:description>
            TAML Test Case to validate digital Invoice against UBL 2.0 XML Schema.
        </taml:description>
        
        <taml:normativeSource>
            <taml:comment></taml:comment>
            <taml:refSourceItem></taml:refSourceItem>
            <taml:textSourceItem>To be a conforming UBL 2 invoice the document MUST be valid according
            to a standard UBL 2 Invoice schema.</taml:textSourceItem>
        </taml:normativeSource>

        <taml:var vname="ublin" vtype="http://www.w3.org/TR/xpath20/">count(//ublin:Invoice) ge 1</taml:var>
        
        <taml:target type="xml">document</taml:target>
        
        <!-- 
            The XPath expression executes the XML Schema validation 
            on the XML root Invoice, calling the XML Schema specified by ublin namespace defined in taml:common.
            The "ge" XPath means "greater than or equal to". 
        -->
        <taml:predicate>ublin</taml:predicate>
        
        <taml:prescription level="mandatory" />
        
        <taml:report 
            label="pass" 
            message="OK validation standard UBL 2 invoice">
            The file is valid against UBL2 Invoice XML Schema.
        </taml:report>
        <taml:report 
            label="fail" 
            when="count(//in:Invoice) eq 0"
            message="Not a standard UBL 2 invoice">
            The file does not contain a valid UBL 2 invoice.
        </taml:report>

        <tebes:note id="NT-001" lg="it">Work in progress...</tebes:note>
    </taml:testAssertion>
	
</taml:testAssertionSet>
