<?xml version="1.0" encoding="UTF-8"?>
<?xml-stylesheet type="text/xsl" href="../../../xsl/TeBES_TestSuite.xsl" ?>
<!-- 
    Created by Cristiano Novelli 
    ENEA, Bologna, 2012-25-05   
    Version=0.1
    
    Notes:
    - The tebes namespace is defined to extend TAML with new elements or attributes used in the TeBES platform
-->

<taml:testAssertionSet 
    xmlns:taml="http://docs.oasis-open.org/ns/tag/taml-201002/"
    xmlns:xsi="http://www.w3.org/2001/XMLSchema-instance"
    xsi:schemaLocation="http://docs.oasis-open.org/ns/tag/taml-201002/ http://docs.oasis-open.org/tag/taml/v1.0/cs02/xsd/testAssertionMarkupLanguage.xsd"
    xmlns:tebes="http://www.ubl-italia.org/TeBES"
    setid="TC-001_TS-002"
    setname="Test Case for UBL Invoice BII Schematron validation"
	tebes:version="0.1">
    
    <taml:testAssertionRefList listname="prerequisites">   
        <!-- 
            The taml:testAssertionRef attributes have to take the following values:
            - @taid: testAssertion/@id of the test assertion;
            - @name: testAssertion/@name of the test assertion;
            - @tebes:version: version of this Test Suite specification for TeBES
        -->
        <taml:testAssertionRef 
            taid="TA-001_TC-001_TS-001" 
            name="XMLSchema-UBL-T10" 
            sourcedoc="http://winter.bologna.enea.it/tebes-artifacts/testsuites/UBL/TS-001_UBL/TC-001_XMLSchema-UBL-T10.xml" 
            tebes:version="0.1" />   
    </taml:testAssertionRefList>	        	
    
    <taml:testAssertion 
        id="TA-001_TC-001_TS-002" 
        name="BIICORE-UBL-T10" 
        tebes:isNotePresent="false">

        <taml:description>BIICORE UBL Invoice Schematron Validation.</taml:description>
        
        <taml:normativeSource>
            <taml:comment></taml:comment>
            <taml:refSourceItem></taml:refSourceItem>
            <taml:textSourceItem></taml:textSourceItem>
        </taml:normativeSource>

        <taml:var vname="TA-001_TC-001_TS-001" vtype="http://docs.oasis-open.org/ns/tag/taml-201002/">taml:TA-001_TC-001_TS-001 eq 'pass'</taml:var>
        
        <taml:var vname="BIICORE-UBL-T10" vtype="http://purl.oclc.org/dsdl/schematron">http://winter.bologna.enea.it/peppol_schema_rep/schematron/biicore/BIICORE-UBL-T10.sch</taml:var>
        
        <!-- XML document, target of Test --> 
        <taml:target type="xml">document</taml:target>
        
        <taml:prerequisite>TA-001_TC-001_TS-001</taml:prerequisite>
        
        <taml:predicate>BIICORE-UBL-T10</taml:predicate>
        
        <taml:prescription level="mandatory" />
        
        <taml:report 
            label="pass" 
            message="OK BIICORE Schematron validation of UBL Invoice">The file is valid against BIICORE UBL Invoice Schematron.</taml:report>
        <taml:report 
            label="fail" 
            message="Failed BIICORE Schematron UBL Invoice validation">The file does not contain an UBL Invoice valid against BIICORE Schematron.</taml:report>
        <taml:report 
            label="notQualified" 
            message="Not qualified to perform the BIICORE Schematron UBL Invoice validation">The file is not qualified to perform the BIICORE Schematron UBL Invoice validation.</taml:report>
    </taml:testAssertion>
	
    <taml:testAssertion 
        id="TA-002_TC-001_TS-002" 
        name="BIIPROFILES-UBL-T10" 
        tebes:isNotePresent="false">
        
        <taml:description>BIIPROFILES UBL Invoice Schematron Validation.</taml:description>
        
        <taml:normativeSource>
            <taml:comment></taml:comment>
            <taml:refSourceItem></taml:refSourceItem>
            <taml:textSourceItem></taml:textSourceItem>
        </taml:normativeSource>

        <taml:var vname="TA-001_TC-001_TS-002" vtype="http://docs.oasis-open.org/ns/tag/taml-201002/">taml:TA-001_TC-001_TS-002 eq 'pass'</taml:var>
        
        <taml:var vname="BIIPROFILES-UBL-T10" vtype="http://purl.oclc.org/dsdl/schematron">http://winter.bologna.enea.it/peppol_schema_rep/schematron/biiprofiles/BIIPROFILES-UBL-T10.sch</taml:var>
        
        <!-- XML document, target of Test -->
        <taml:target type="document" lg="xml">document</taml:target>
        
        <taml:prerequisite>TA-001_TC-001_TS-002</taml:prerequisite>
        
        <taml:predicate>BIIPROFILES-UBL-T10</taml:predicate>
        
        <taml:prescription level="mandatory" />
        
        <taml:report 
            label="pass" 
            message="OK BIIPROFILES-UBL-T10 Schematron validation of UBL Invoice">The file is valid against UBL2 Invoice BIIPROFILES-UBL-T10 Schematron.</taml:report>
        <taml:report 
            label="fail" 
            message="Failed BIIPROFILES-UBL-T10 Schematron UBL Invoice validation">The file does not contain an UBL Invoice valid against BIIPROFILES-UBL-T10 Schematron.</taml:report>
        <taml:report 
            label="notQualified" 
            message="Not qualified to perform the BIIPROFILES Schematron UBL Invoice validation">The file is not qualified to perform the BIIPROFILES Schematron UBL Invoice validation</taml:report>
    </taml:testAssertion>
    
    <taml:testAssertion 
        id="TA-003_TC-001_TS-002" 
        name="BIIRULES-UBL-T10" 
        tebes:isNotePresent="false">
        
        <taml:description>BIIRULES UBL Invoice Schematron Validation.</taml:description>
        
        <taml:normativeSource>
            <taml:comment></taml:comment>
            <taml:refSourceItem></taml:refSourceItem>
            <taml:textSourceItem></taml:textSourceItem>
        </taml:normativeSource>
        
        <taml:var vname="TA-002_TC-001_TS-002" vtype="http://docs.oasis-open.org/ns/tag/taml-201002/">taml:TA-002_TC-001_TS-002 eq 'pass'</taml:var>
        
        <taml:var vname="BIIRULES-UBL-T10" vtype="http://purl.oclc.org/dsdl/schematron">http://winter.bologna.enea.it/peppol_schema_rep/schematron/biirules/BIIRULES-UBL-T10.sch</taml:var>
        
        <!-- XML document, target of Test -->
        <taml:target type="xml">document</taml:target>
        
        <taml:prerequisite>TA-002_TC-001_TS-002</taml:prerequisite>
        
        <taml:predicate>BIIRULES-UBL-T10</taml:predicate>

        <taml:prescription level="mandatory" />
        
        <taml:report 
            label="pass" 
            message="OK BIIRULES-UBL-T10 Schematron validation of UBL Invoice">The file is valid against UBL2 Invoice BIIRULES-UBL-T10 Schematron.</taml:report>
        <taml:report 
            label="fail" 
            message="Failed BIIRULES-UBL-T10 Schematron UBL Invoice validation">The file does not contain an UBL Invoice valid against BIIRULES-UBL-T10 Schematron.</taml:report>
        <taml:report 
            label="notQualified" 
            message="Not qualified to perform the BIIRULES Schematron UBL Invoice validation">The file is not qualified to perform the BIIRULES Schematron UBL Invoice validation.</taml:report>
    </taml:testAssertion>
    
</taml:testAssertionSet>
