<?xml version="1.0" encoding="UTF-8"?>
<?xml-stylesheet type="text/xsl" href="../../../xsl/TeBES_TestSuite.xsl" ?>
<!-- 
	Created by Cristiano Novelli 
	ENEA, Bologna, 2014-21-07   
	Version=0.2
-->

<taml:testAssertionSet 
    xmlns:taml="http://docs.oasis-open.org/ns/tag/taml-201002/"
    xmlns:xsi="http://www.w3.org/2001/XMLSchema-instance"
    xsi:schemaLocation="http://docs.oasis-open.org/ns/tag/taml-201002/ http://docs.oasis-open.org/tag/taml/v1.0/cs02/xsd/testAssertionMarkupLanguage.xsd"
	xmlns:tebes="http://www.ubl-italia.org/tebes"
    setid="TC-001_TS-006"
    setname="Test Case for Web Service SOAP Envelope validation."
	tebes:version="0.2">

    <taml:common>
        <taml:namespaces 
            xmlns:soap="http://schemas.xmlsoap.org/soap/envelope/envelope.xml" />
    </taml:common>
    
    
    <taml:testAssertion 
        id="TA-001_TC-001_TS-006" 
        name="SOAPValidation" 
        tebes:isNotePresent="false">

        <taml:description>Web Service SOAP Envelope Validation.</taml:description>
        
        <taml:normativeSource>
            <taml:comment></taml:comment>
            <taml:refSourceItem></taml:refSourceItem>
            <taml:textSourceItem></taml:textSourceItem>
        </taml:normativeSource>

        <taml:var vname="soap-validation" vtype="http://www.w3.org/TR/xpath20/">count(//soap:Envelope) ge 1</taml:var>
        
        <taml:target type="transport" lg="xml">soap-validation</taml:target>
        
        <!-- 
            The XPath expression executes the XML Schema validation 
            on the XML root Invoice, calling the XML Schema specified by soap: namespace defined in taml:common.
            The "ge" XPath means "greater than or equal to". 
        -->
        <taml:predicate>soap-validation</taml:predicate>
        
        <taml:prescription level="mandatory" />
        
        <taml:report 
            label="pass" 
            message="OK validation SOAP Envelope.">The message is valid against SOAP Envelope XML Schema.</taml:report>
        <taml:report 
            label="fail" 
            when="count(//soap:Envelope) ge 0"
            message="SOAP Envelope IS NOT VALID.">The message is NOT valid against SOAP Envelope XML Schema.</taml:report>

    </taml:testAssertion>
	
    
</taml:testAssertionSet>
